<?xml version="1.0" encoding="iso-8859-1"?>
<!DOCTYPE Form SYSTEM "Form.dtd">
<Form
	DTDVersion="05.05.12"
	TargetLanguage="HTML"
	Archetype="Default"
	PositionTop="458"
	PositionLeft="214"
	PositionWidth="215"
	PositionHeight="44"
	IsAddedAfterGen="False"
	HasCustomFormLayout="False"
	ObjectsUnusedByFormLayout="False"
	External="False"
	NoDataForm="False"
	ClassName="versata.pdx.html.VSPagePDX"
	ObjectsRemovedFromLayout="False"
	HTMLFileCheckSum="-231917153"
	>
	<FormCaption><![CDATA[Parent Repl Attrs]]></FormCaption>
	<ArchetypeExtendedProperties>
		<Property
			Name="Comments"
			Value=""
		/>
		<Property
			Name="CommentsTrailing"
			Value=""
		/>
		<Property
			Name="CrumbTrailEnabled"
			Value="true"
		/>
		<Property
			Name="CrumbTrailIncludesThisPage"
			Value="true"
		/>
		<Property
			Name="CrumbTrailRestartsHere"
			Value="false"
		/>
		<Property
			Name="CrumbTrailSeparator"
			Value="&gt;"
		/>
		<Property
			Name="ErrorStyle"
			Value="Popup"
		/>
		<Property
			Name="IncludeFooter"
			Value="false"
		/>
		<Property
			Name="IncludeHeader"
			Value="false"
		/>
		<Property
			Name="IncludeLeftBar"
			Value="false"
		/>
		<Property
			Name="IncludeRightBar"
			Value="false"
		/>
		<Property
			Name="ShowCancelButton"
			Value="true"
		/>
		<Property
			Name="showFormCaption"
			Value="true"
		/>
		<Property
			Name="ShowReturnButton"
			Value="true"
		/>
		<Property
			Name="TransitionsToHide"
			Value=""
		/>
	</ArchetypeExtendedProperties>
	<RecordSource
		RSID="1"
		Prefix="T1"
		BusinessObject="Qry_AttrParentRepl"
		RelnIsFromParent="False"
		DoesSourceAffectMe="False"
		DoIAffectSource="False"
		IsAddedAfterGen="False"
		RsAttributesDefault="False"
		ClassName="versata.pdx.html.DataSourcePDX"
		RecordSourceArchetype="Grid"
		MaxGridRowCount="10"
		FetchedBlockRowCount="16"
		AllowDelete="False"
		AllowInsert="False"
		AllowUpdate="False"
		SaveMode="Immediate"
		PreFetchRowCount="False"
		>
		<ParameterizedWhereClause><![CDATA[ ]]></ParameterizedWhereClause>
		<AdditionalWhereClause><![CDATA[ ]]></AdditionalWhereClause>
		<OrderByClause><![CDATA[ ]]></OrderByClause>
		<RSAttributesMeta>
			<DefaultAttributes>
				<RSDefaultAttribute ID="1" Name="AttrName" />
				<RSDefaultAttribute ID="2" Name="Persistent" />
				<RSDefaultAttribute ID="3" Name="ValueRequired" />
				<RSDefaultAttribute ID="4" Name="PreventUserUpdate" />
				<RSDefaultAttribute ID="5" Name="DataType" />
				<RSDefaultAttribute ID="6" Name="Size" />
				<RSDefaultAttribute ID="7" Name="Caption" />
				<RSDefaultAttribute ID="8" Name="Description" />
				<RSDefaultAttribute ID="9" Name="Comments" />
				<RSDefaultAttribute ID="10" Name="SourceAttr" />
				<RSDefaultAttribute ID="11" Name="SourceDataObject" />
				<RSDefaultAttribute ID="12" Name="ParentReplicateIsMaintained" />
				<RSDefaultAttribute ID="13" Name="ParentRepl_Cnt" />
				<RSDefaultAttribute ID="14" Name="RepositoryName" />
				<RSDefaultAttribute ID="15" Name="DataObjectName" />
			</DefaultAttributes>
			<ScalerAttributes>
				<RSAttribute Name="AttrName" Displayed="True" UnPlaced="False" />
				<RSAttribute Name="Persistent" Displayed="True" UnPlaced="False" />
				<RSAttribute Name="ValueRequired" Displayed="True" UnPlaced="False" />
				<RSAttribute Name="PreventUserUpdate" Displayed="True" UnPlaced="False" />
				<RSAttribute Name="DataType" Displayed="True" UnPlaced="False" />
				<RSAttribute Name="Size" Displayed="True" UnPlaced="False" />
				<RSAttribute Name="Caption" Displayed="True" UnPlaced="False" />
				<RSAttribute Name="Description" Displayed="True" UnPlaced="False" />
				<RSAttribute Name="Comments" Displayed="True" UnPlaced="False" />
				<RSAttribute Name="SourceAttr" Displayed="True" UnPlaced="False" />
				<RSAttribute Name="SourceDataObject" Displayed="True" UnPlaced="False" />
				<RSAttribute Name="ParentReplicateIsMaintained" Displayed="True" UnPlaced="False" />
				<RSAttribute Name="ParentRepl_Cnt" Displayed="True" UnPlaced="False" />
				<RSAttribute Name="RepositoryName" Displayed="True" UnPlaced="False" />
				<RSAttribute Name="DataObjectName" Displayed="True" UnPlaced="False" />
			</ScalerAttributes>
			<GridAttributes>
				<RSAttribute Name="AttrName" Displayed="True" UnPlaced="False" />
				<RSAttribute Name="Persistent" Displayed="True" UnPlaced="False" />
				<RSAttribute Name="ValueRequired" Displayed="True" UnPlaced="False" />
				<RSAttribute Name="PreventUserUpdate" Displayed="True" UnPlaced="False" />
				<RSAttribute Name="DataType" Displayed="True" UnPlaced="False" />
				<RSAttribute Name="Size" Displayed="True" UnPlaced="False" />
				<RSAttribute Name="Caption" Displayed="True" UnPlaced="False" />
				<RSAttribute Name="Description" Displayed="True" UnPlaced="False" />
				<RSAttribute Name="Comments" Displayed="True" UnPlaced="False" />
				<RSAttribute Name="SourceAttr" Displayed="True" UnPlaced="False" />
				<RSAttribute Name="SourceDataObject" Displayed="True" UnPlaced="False" />
				<RSAttribute Name="ParentReplicateIsMaintained" Displayed="True" UnPlaced="False" />
				<RSAttribute Name="ParentRepl_Cnt" Displayed="False" UnPlaced="False" />
				<RSAttribute Name="RepositoryName" Displayed="True" UnPlaced="False" />
				<RSAttribute Name="DataObjectName" Displayed="True" UnPlaced="False" />
			</GridAttributes>
		</RSAttributesMeta>
		<ArchetypeExtendedProperties>
			<Property
				Name="AltRowColor"
				Value="#DFE5EF"
			/>
			<Property
				Name="Caption"
				Value=""
			/>
			<Property
				Name="Comments"
				Value=""
			/>
			<Property
				Name="CommentsTrailing"
				Value="&lt;br&gt;"
			/>
			<Property
				Name="Cond0HideRecSrc"
				Value=""
			/>
			<Property
				Name="Cond1"
				Value=""
			/>
			<Property
				Name="Cond1Actions"
				Value=""
			/>
			<Property
				Name="Cond2"
				Value=""
			/>
			<Property
				Name="Cond2Actions"
				Value=""
			/>
			<Property
				Name="Cond3"
				Value=""
			/>
			<Property
				Name="Cond3Actions"
				Value=""
			/>
			<Property
				Name="Cond4"
				Value=""
			/>
			<Property
				Name="Cond4Actions"
				Value=""
			/>
			<Property
				Name="Cond5"
				Value=""
			/>
			<Property
				Name="Cond5Actions"
				Value=""
			/>
			<Property
				Name="ConfirmDeleteMsg"
				Value="Delete record?"
			/>
			<Property
				Name="NoDataMessage"
				Value="&lt;br&gt;&lt;center&gt;&lt;b&gt;No records found!&lt;/b&gt;&lt;/center&gt;&lt;br&gt;"
			/>
			<Property
				Name="ShowHeader"
				Value="true"
			/>
			<Property
				Name="ShowRowCount"
				Value="true"
			/>
			<Property
				Name="ShowRowSelector"
				Value="true"
			/>
			<Property
				Name="SortableHeader"
				Value="true"
			/>
			<Property
				Name="TabCaption"
				Value=""
			/>
			<Property
				Name="TabGenerated"
				Value="true"
			/>
			<Property
				Name="TabImageHeight"
				Value=""
			/>
			<Property
				Name="TabImageOff"
				Value=""
			/>
			<Property
				Name="TabImageOn"
				Value=""
			/>
			<Property
				Name="TabImageWidth"
				Value=""
			/>
			<Property
				Name="UsePopupPicks"
				Value="true"
			/>
		</ArchetypeExtendedProperties>
	</RecordSource>
</Form>